{
  "format": "tsuyomi-repository",
  "version": 1,
  "keyId": "repository-cancellation-test",
  "signed": {
    "expiresAt": "2026-09-12T00:00:00Z",
    "issuedAt": "2026-09-11T00:00:00Z",
    "packages": [],
    "publishers": [],
    "repositoryId": "org.tsuyomi.extensions",
    "revocations": {
      "packageDigests": [
        "36db147337636ddc1b5bb00a979e42bb82e97f419ab374c6a5cb62ce852d6af6"
      ],
      "publisherFingerprints": []
    },
    "sequence": 1
  },
  "signature": "IPdKOPKvaaxvT+sgAKuJuCIWwBTyBucdQjI8TO6FLSi8VwlyqXAhDDh1FyPPfiV7DQFbgilV/pIoHkK7au14DA=="
}
