{
  "format": "tsuyomi-repository",
  "version": 1,
  "keyId": "fixture-root-key",
  "signed": {
    "repositoryId": "org.tsuyomi.extensions",
    "sequence": 1,
    "issuedAt": "2030-01-01T00:00:00Z",
    "expiresAt": "2030-01-15T00:00:00Z",
    "publishers": [
      {
        "keyId": "fixture-publisher-key",
        "publicKey": "11qYAYKxCrfVS/7TyWQHOg7hcvPapiMlrwIaaPcHURo=",
        "fingerprint": "21fe31dfa154a261626bf854046fd2271b7bed4b6abe45aa58877ef47f9721b9"
      }
    ],
    "packages": [
      {
        "id": "org.tsuyomi.fixture",
        "name": "Fixture source",
        "version": "1.0.0",
        "summary": "Deterministic repository fixture.",
        "language": "JavaScript",
        "license": "AGPL-3.0-only",
        "sourceUrl": "https://example.test/fixture-source",
        "sourceRevision": "0123456789abcdef0123456789abcdef01234567",
        "downloadUrl": "https://example.test/fixture.hxp",
        "size": 1024,
        "sha256": "0123456789abcdef0123456789abcdef0123456789abcdef0123456789abcdef",
        "hostApi": {
          "minInclusive": "1.0.0",
          "maxExclusive": "2.0.0"
        },
        "publisherKeyId": "fixture-publisher-key"
      }
    ],
    "revocations": {
      "publisherFingerprints": [],
      "packageDigests": []
    }
  },
  "signature": "tp7OS9eMAw25f3zHAQMjxQXBK02pfdLqOZ5S+QPYEjR9VfmCVGWCi92ZbmbsvtwnA+gkPIhWuIT7m5bukKg4CQ=="
}
